[
  {
    "id": "wa",
    "pattern": "〜は",
    "romaji": "wa",
    "level": "N5",
    "meaning": "as for; marks the topic of the sentence",
    "formation": "Noun + は",
    "examples": [
      {
        "ja": "私は学生です。",
        "furigana": "{私|わたし}は{学生|がくせい}です。",
        "en": "I am a student."
      },
      {
        "ja": "今日は天気がいいです。",
        "furigana": "{今日|きょう}は{天気|てんき}がいいです。",
        "en": "The weather is nice today."
      },
      {
        "ja": "この本はおもしろいです。",
        "furigana": "この{本|ほん}はおもしろいです。",
        "en": "This book is interesting."
      }
    ],
    "tags": [
      "particle",
      "topic"
    ],
    "notes": "Written は but pronounced 'wa'. It sets up what the sentence is about; the key information comes after it.",
    "zh": {
      "status": "draft",
      "source_hash": "3176e50529d6bda7707f7a4b5a7963c699a1d9b8d96440156d6a0a474c9e3958",
      "meanings": [
        "至于……",
        "提示话题"
      ],
      "formation": "名词＋は",
      "explanation": "把某人或某事设为谈论的话题，再说明其情况。也可用于对比。",
      "notes": "写作は，读作wa。话题不一定是句子的主语。",
      "examples": [
        {
          "ja": "私は学生です。",
          "zh": "我是学生。"
        },
        {
          "ja": "今日は天気がいいです。",
          "zh": "今天天气很好。"
        },
        {
          "ja": "この本はおもしろいです。",
          "zh": "这本书很有意思。"
        }
      ],
      "references": [
        "sources/grammar/n5.json#wa",
        "Original Chinese draft by Codex; not human-reviewed"
      ]
    }
  },
  {
    "id": "ga-subject",
    "pattern": "〜が（subject）",
    "romaji": "ga (subject)",
    "level": "N5",
    "meaning": "marks the subject; points out new or focused information",
    "formation": "Noun + が",
    "examples": [
      {
        "ja": "雨が降っています。",
        "furigana": "{雨|あめ}が{降|ふ}っています。",
        "en": "It is raining."
      },
      {
        "ja": "だれが窓を開けましたか。",
        "furigana": "だれが{窓|まど}を{開|あ}けましたか。",
        "en": "Who opened the window?"
      },
      {
        "ja": "私が行きます。",
        "furigana": "{私|わたし}が{行|い}きます。",
        "en": "I'll be the one to go."
      }
    ],
    "tags": [
      "particle"
    ],
    "notes": "Question words such as だれ and 何 take が, never は, when they are the subject. が is also used with 好き, ほしい, 上手 and わかる for the thing liked, wanted or understood.",
    "zh": {
      "status": "draft",
      "source_hash": "6fd39578a6caa28da48534dec9128ebf021b902198d26f46d18fcf4d14c5cf1b",
      "meanings": [
        "提示主语",
        "突出新信息"
      ],
      "formation": "名词＋が",
      "explanation": "用于说明谁或什么做某事，或介绍新出现的人、事物。回答“谁去”时，用私が行きます突出“我”。",
      "notes": "疑问词作主语时通常用が；与は的区别需要结合上下文判断。",
      "examples": [
        {
          "ja": "雨が降っています。",
          "zh": "正在下雨。"
        },
        {
          "ja": "だれが窓を開けましたか。",
          "zh": "谁把窗户打开了？"
        },
        {
          "ja": "私が行きます。",
          "zh": "我去。"
        }
      ],
      "references": [
        "sources/grammar/n5.json#ga-subject",
        "Original Chinese draft by Codex; not human-reviewed"
      ]
    }
  },
  {
    "id": "o",
    "pattern": "〜を",
    "romaji": "o",
    "level": "N5",
    "meaning": "marks the direct object of a verb; marks a place moved through or left",
    "formation": "Noun + を",
    "examples": [
      {
        "ja": "毎朝パンを食べます。",
        "furigana": "{毎朝|まいあさ}パンを{食|た}べます。",
        "en": "I eat bread every morning."
      },
      {
        "ja": "姉は新しいかばんを買いました。",
        "furigana": "{姉|あね}は{新|あたら}しいかばんを{買|か}いました。",
        "en": "My older sister bought a new bag."
      },
      {
        "ja": "公園を散歩しました。",
        "furigana": "{公園|こうえん}を{散歩|さんぽ}しました。",
        "en": "I took a walk in the park."
      }
    ],
    "tags": [
      "particle"
    ],
    "notes": "Written を but pronounced 'o'. With movement verbs such as 歩く, 散歩する and 出る it marks the route or the place being left.",
    "zh": {
      "status": "draft",
      "source_hash": "bcab0dc2551d165d900894c81347803e39905b3ae3738bcc121fbb50685275d3",
      "meanings": [
        "提示动作对象",
        "提示经过或离开的地点"
      ],
      "formation": "名词＋を",
      "explanation": "常接在动作作用的对象后；与移动动词搭配时，也能表示经过的路线或离开的地点。",
      "notes": "写作を，通常读作o。公園を散歩する强调在公园里走动。",
      "examples": [
        {
          "ja": "毎朝パンを食べます。",
          "zh": "我每天早晨吃面包。"
        },
        {
          "ja": "姉は新しいかばんを買いました。",
          "zh": "姐姐买了一个新包。"
        },
        {
          "ja": "公園を散歩しました。",
          "zh": "我在公园散步了。"
        }
      ],
      "references": [
        "sources/grammar/n5.json#o",
        "Original Chinese draft by Codex; not human-reviewed"
      ]
    }
  },
  {
    "id": "ni-time",
    "pattern": "〜に（time）",
    "romaji": "ni (time)",
    "level": "N5",
    "meaning": "at; on; in (a specific point in time)",
    "formation": "Noun + に",
    "examples": [
      {
        "ja": "毎朝7時に起きます。",
        "furigana": "{毎朝|まいあさ}7{時|じ}に{起|お}きます。",
        "en": "I get up at seven every morning."
      },
      {
        "ja": "日曜日に友達と会います。",
        "furigana": "{日曜日|にちようび}に{友達|ともだち}と{会|あ}います。",
        "en": "I'm meeting a friend on Sunday."
      },
      {
        "ja": "8月に国へ帰ります。",
        "furigana": "8{月|がつ}に{国|くに}へ{帰|かえ}ります。",
        "en": "I'm going back to my country in August."
      }
    ],
    "tags": [
      "particle",
      "time"
    ],
    "notes": "Used with clock times, dates, days of the week and months. Relative words such as 今日, 明日, 毎日 and 来週 take no に.",
    "zh": {
      "status": "draft",
      "source_hash": "22dd5f3fdd4c81678bbdf62540b849d03ef4b05f91333099b9f7341d1f60f4d0",
      "meanings": [
        "在……时间"
      ],
      "formation": "具体时间名词＋に",
      "explanation": "表示动作发生的具体时间点，可用于钟点、日期、星期等。",
      "notes": "今日、明日、毎日等相对时间通常不加に；星期名称后的に有时可省略。",
      "examples": [
        {
          "ja": "毎朝7時に起きます。",
          "zh": "我每天早上七点起床。"
        },
        {
          "ja": "日曜日に友達と会います。",
          "zh": "我星期天和朋友见面。"
        },
        {
          "ja": "8月に国へ帰ります。",
          "zh": "我八月回国。"
        }
      ],
      "references": [
        "sources/grammar/n5.json#ni-time",
        "Original Chinese draft by Codex; not human-reviewed"
      ]
    }
  },
  {
    "id": "ni-destination",
    "pattern": "〜に（destination）",
    "romaji": "ni (destination)",
    "level": "N5",
    "meaning": "to; into (the destination of movement)",
    "formation": "Noun + に + 行く / 来る / 帰る",
    "examples": [
      {
        "ja": "毎日バスで学校に行きます。",
        "furigana": "{毎日|まいにち}バスで{学校|がっこう}に{行|い}きます。",
        "en": "I go to school by bus every day."
      },
      {
        "ja": "夜10時に家に帰りました。",
        "furigana": "{夜|よる}10{時|じ}に{家|いえ}に{帰|かえ}りました。",
        "en": "I got home at 10 p.m."
      },
      {
        "ja": "来月、姉が日本に来ます。",
        "furigana": "{来月|らいげつ}、{姉|あね}が{日本|にほん}に{来|き}ます。",
        "en": "My older sister is coming to Japan next month."
      }
    ],
    "tags": [
      "particle"
    ],
    "notes": "Close in meaning to へ. に puts the focus on the arrival point, へ on the direction.",
    "zh": {
      "status": "draft",
      "source_hash": "06b0e934d16e9c9e52e9ffda249d50fbf756858b063f5dd06c36e56de92d65ad",
      "meanings": [
        "到……",
        "去往……"
      ],
      "formation": "地点名词＋に＋行く／来る／帰る",
      "explanation": "标记移动的目的地或到达点，常与去、来、回等动词搭配。",
      "notes": "に偏重到达点，へ偏重方向；许多移动句中两者都能使用。",
      "examples": [
        {
          "ja": "毎日バスで学校に行きます。",
          "zh": "我每天坐公交车去学校。"
        },
        {
          "ja": "夜10時に家に帰りました。",
          "zh": "我晚上十点回到家了。"
        },
        {
          "ja": "来月、姉が日本に来ます。",
          "zh": "姐姐下个月来日本。"
        }
      ],
      "references": [
        "sources/grammar/n5.json#ni-destination",
        "Original Chinese draft by Codex; not human-reviewed"
      ]
    }
  },
  {
    "id": "ni-location",
    "pattern": "〜に（place of existence）",
    "romaji": "ni (location)",
    "level": "N5",
    "meaning": "in; at; on (where someone or something is)",
    "formation": "Noun + に + ある / いる",
    "examples": [
      {
        "ja": "机の上に辞書があります。",
        "furigana": "{机|つくえ}の{上|うえ}に{辞書|じしょ}があります。",
        "en": "There is a dictionary on the desk."
      },
      {
        "ja": "姉は東京に住んでいます。",
        "furigana": "{姉|あね}は{東京|とうきょう}に{住|す}んでいます。",
        "en": "My older sister lives in Tokyo."
      },
      {
        "ja": "猫は今どこにいますか。",
        "furigana": "{猫|ねこ}は{今|いま}どこにいますか。",
        "en": "Where is the cat now?"
      }
    ],
    "tags": [
      "particle"
    ],
    "notes": "Used with ある, いる and 住む. For the place where an action happens (eat, study, play), use で instead.",
    "zh": {
      "status": "draft",
      "source_hash": "4296c668739177e8285b1bfd77ea3227a9e8f273d80a260662844fb0a80a5266",
      "meanings": [
        "在……（存在的地点）"
      ],
      "formation": "地点名词＋に＋ある／いる",
      "explanation": "说明人或事物存在的位置，也可与住む等表示居住的动词搭配。",
      "notes": "ある通常用于无生命事物，いる用于人或动物；活动发生的场所通常用で。",
      "examples": [
        {
          "ja": "机の上に辞書があります。",
          "zh": "桌子上有一本词典。"
        },
        {
          "ja": "姉は東京に住んでいます。",
          "zh": "姐姐住在东京。"
        },
        {
          "ja": "猫は今どこにいますか。",
          "zh": "猫现在在哪里？"
        }
      ],
      "references": [
        "sources/grammar/n5.json#ni-location",
        "Original Chinese draft by Codex; not human-reviewed"
      ]
    }
  },
  {
    "id": "ni-indirect-object",
    "pattern": "〜に（indirect object）",
    "romaji": "ni (indirect object)",
    "level": "N5",
    "meaning": "to (the person who receives or is the target of an action)",
    "formation": "Noun + に",
    "examples": [
      {
        "ja": "母に手紙を書きます。",
        "furigana": "{母|はは}に{手紙|てがみ}を{書|か}きます。",
        "en": "I'm going to write a letter to my mother."
      },
      {
        "ja": "妹に本を貸しました。",
        "furigana": "{妹|いもうと}に{本|ほん}を{貸|か}しました。",
        "en": "I lent a book to my younger sister."
      },
      {
        "ja": "友達に電話をかけました。",
        "furigana": "{友達|ともだち}に{電話|でんわ}をかけました。",
        "en": "I called my friend."
      }
    ],
    "tags": [
      "particle"
    ],